{
  "schema_version": "1.1",
  "document_id": "deep-reading-paper-001",
  "document_kind": "ai_deep_reading",
  "language": "zh-CN",
  "title": "AI 论文精读报告",
  "subtitle": "Example Method Paper",
  "metadata": {
    "作者": "A. Author",
    "年份": 2026,
    "分析版本": "Uploaded PDF",
    "材料覆盖": "充分",
    "证据定位": "可定位至章节/图表",
    "外部核验": "仅基于本文"
  },
  "blocks": [
    {
      "type": "heading",
      "role": "heading1",
      "level": 1,
      "text": "01 论文速览"
    },
    {
      "type": "callout",
      "role": "analysis",
      "title": "一句话看懂",
      "text": "The paper replaces global matching with descriptor-level matching, with bounded evidence for the tested setup."
    },
    {
      "type": "table",
      "role": "table",
      "caption": "科研判断卡",
      "headers": [
        "项目",
        "判断"
      ],
      "rows": [
        [
          "核心问题",
          "Whether global image matching discards useful local evidence in few-shot classification."
        ],
        [
          "核心方法",
          "Descriptor-level query-to-support matching with aggregated class similarity."
        ],
        [
          "真正变化",
          "The paper-framed delta is replacing global matching with learnable local matching inside the few-shot classifier."
        ],
        [
          "最强证据",
          "The inspected method section directly describes descriptor-level matching."
        ],
        [
          "最大风险",
          "Performance may depend on local descriptors being class-discriminative rather than noisy."
        ],
        [
          "最重要开放问题",
          "How robust is local matching to uninformative or background descriptors?"
        ],
        [
          "关键假设",
          "Local descriptor matches are sufficiently discriminative."
        ]
      ],
      "column_widths_pct": [
        22,
        78
      ]
    },
    {
      "type": "table",
      "role": "table",
      "headers": [
        "项目",
        "判断"
      ],
      "rows": [
        [
          "论文内部证据支持",
          "有一定支持"
        ],
        [
          "阅读优先级",
          "建议重点阅读核心章节"
        ],
        [
          "理由",
          "The method is concise; the Method section carries most of the value."
        ],
        [
          "适合读者",
          "Few-shot learning researchers；Metric-learning practitioners"
        ]
      ],
      "column_widths_pct": [
        24,
        76
      ]
    },
    {
      "type": "table",
      "role": "table",
      "caption": "研究价值",
      "headers": [
        "维度",
        "等级",
        "理由"
      ],
      "rows": [
        [
          "方法学价值",
          "中",
          "The design change is clear and transferable."
        ],
        [
          "实证价值",
          "中",
          "The paper reports benchmark evidence, but visual artifacts were not inspected."
        ],
        [
          "应用价值",
          "暂不明确",
          "Deployment robustness is not established."
        ]
      ],
      "column_widths_pct": [
        18,
        12,
        70
      ]
    },
    {
      "type": "heading",
      "role": "heading2",
      "level": 2,
      "text": "材料覆盖"
    },
    {
      "type": "table",
      "role": "table",
      "headers": [
        "材料",
        "状态",
        "说明"
      ],
      "rows": [
        [
          "正文",
          "已获取",
          "Readable body text inspected."
        ],
        [
          "章节结构",
          "已获取",
          "Section structure available."
        ],
        [
          "表格",
          "未获取",
          "Tables not independently inspected."
        ],
        [
          "图",
          "未获取",
          "Figures not independently inspected."
        ],
        [
          "公式",
          "未获取",
          "Equations not independently inspected."
        ],
        [
          "附录",
          "未核验",
          "Appendix not checked."
        ],
        [
          "Supplement",
          "未核验",
          "Supplement not checked."
        ],
        [
          "代码",
          "未核验",
          "Code not checked."
        ],
        [
          "外部文献",
          "未核验",
          "No external novelty verification."
        ]
      ],
      "column_widths_pct": [
        18,
        18,
        64
      ]
    },
    {
      "type": "heading",
      "role": "heading1",
      "level": 1,
      "text": "02 研究问题与 Gap"
    },
    {
      "type": "paragraph",
      "role": "body",
      "text": "研究问题：Can descriptor-level matching improve few-shot classification relative to global matching?"
    },
    {
      "type": "callout",
      "role": "evidence",
      "title": "原文依据",
      "text": "We propose a local matching method for few-shot classification.",
      "meta": {
        "证据": "E1",
        "位置": "Abstract"
      }
    },
    {
      "type": "paragraph",
      "role": "body",
      "text": "作者界定的问题：The paper frames global matching as potentially inadequate for few-shot classification."
    },
    {
      "type": "paragraph",
      "role": "body",
      "text": "论文声称的 Gap：The paper motivates local descriptor matching as an alternative to a single global representation."
    },
    {
      "type": "paragraph",
      "role": "analysis",
      "text": "PaperScope 判断的实际瓶颈：The operational bottleneck is whether a sparse support set is better represented as a pool of local evidence rather than one global vector."
    },
    {
      "type": "callout",
      "role": "evidence",
      "title": "原文依据",
      "text": "Each query descriptor is compared with support descriptors and the similarities are aggregated.",
      "meta": {
        "证据": "E2",
        "位置": "Method"
      }
    },
    {
      "type": "callout",
      "role": "analysis",
      "title": "Gap 判断",
      "text": "Gap 部分成立。The inspected material motivates the gap clearly, but the synthetic example does not include a full prior-work comparison.\n依据：E1、E2"
    },
    {
      "type": "heading",
      "role": "heading1",
      "level": 1,
      "text": "03 核心方法与真实创新"
    },
    {
      "type": "paragraph",
      "role": "lead",
      "text": "方法概述：The method performs descriptor-level query-to-support matching."
    },
    {
      "type": "table",
      "role": "table",
      "caption": "方法差异链（Method Diff）",
      "headers": [
        "环节",
        "内容"
      ],
      "rows": [
        [
          "Previous",
          "The paper contrasts the method with global matching.\n依据：E1"
        ],
        [
          "Proposed",
          "Replace global matching with local descriptor aggregation.\n依据：E1、E2"
        ],
        [
          "Mechanism",
          "Query descriptors are compared with support descriptors and similarities are aggregated.\n依据：E2"
        ],
        [
          "Expected Effect",
          "The design may preserve local discriminative information.\n依据：E2"
        ]
      ],
      "column_widths_pct": [
        23,
        77
      ]
    },
    {
      "type": "heading",
      "role": "heading2",
      "level": 2,
      "text": "核心模块"
    },
    {
      "type": "table",
      "role": "table",
      "headers": [
        "模块",
        "作用",
        "输入",
        "操作",
        "输出",
        "为什么需要",
        "依据"
      ],
      "rows": [
        [
          "Local Matching",
          "Compute query-support local similarity",
          "Query and support descriptors",
          "Compare descriptors and aggregate similarity",
          "Class similarity",
          "Avoid relying only on a single global vector",
          "E2"
        ]
      ],
      "column_widths_pct": [
        12,
        14,
        12,
        22,
        12,
        20,
        8
      ]
    },
    {
      "type": "heading",
      "role": "heading2",
      "level": 2,
      "text": "关键假设"
    },
    {
      "type": "callout",
      "role": "warning",
      "title": "假设 A1",
      "text": "Local descriptor matches are sufficiently discriminative.\n来源性质：隐含假设\n风险等级：高\n为什么需要：The class similarity depends on local matches carrying class-discriminative signal.\n若不成立：Noisy descriptors could dominate class similarity.\n如何压力测试：Inject descriptor noise or mask high-similarity local regions and measure class-score sensitivity.\n依据：E2"
    },
    {
      "type": "heading",
      "role": "heading2",
      "level": 2,
      "text": "创新判断"
    },
    {
      "type": "paragraph",
      "role": "analysis",
      "text": "相对本文 prior work 的变化：Relative to the paper-framed baseline, the change is global-to-local matching."
    },
    {
      "type": "callout",
      "role": "note",
      "title": "领域首创性",
      "text": "未进行系统外部文献核验，暂不判断是否属于领域首次提出。"
    },
    {
      "type": "paragraph",
      "role": "note",
      "text": "核验状态：仅完成论文内部比较"
    },
    {
      "type": "heading",
      "role": "heading2",
      "level": 2,
      "text": "主要贡献"
    },
    {
      "type": "paragraph",
      "role": "body",
      "text": "贡献 1：The paper integrates local matching into a few-shot classifier."
    },
    {
      "type": "heading",
      "role": "heading1",
      "level": 1,
      "text": "04 实验与证据"
    },
    {
      "type": "heading",
      "role": "heading2",
      "level": 2,
      "text": "实验解释链"
    },
    {
      "type": "callout",
      "role": "analysis",
      "title": "实验 1",
      "text": "实验目的：Test whether local matching improves few-shot classification relative to global matching.\n设计：Compare the proposed local-matching classifier with a global-matching baseline on the paper's reported benchmark.\n比较条件：Synthetic example; exact table/budget details are not included in the example source bundle.\n结果：The paper reports improved accuracy on the tested setup.\n真正支持：The paper provides within-study evidence that local matching can improve the tested setup.\n不能进一步证明：The example does not establish universal superiority across datasets or domains.\n协议风险：Exact table and training-budget details are not included in this synthetic fixture.\n依据：E1"
    },
    {
      "type": "heading",
      "role": "heading2",
      "level": 2,
      "text": "主要结果"
    },
    {